[
  {
    "owner": "Zekth",
    "name": "der 60%",
    "pcb": "KP XD64",
    "switches": "Kailh Box Brown",
    "keyset": "GMK Plum",
    "description": "c'est un gros clavier de merde",
    "photos": ["zekth-60-1.jpg"]
  },
  {
    "owner": "Zekth",
    "name": "Stealth Split",
    "pcb": "Keeb.io Quefrency 60%",
    "switches": "Kailh Box Black",
    "keyset": "Gentleman Black PBT",
    "description": "Clavier split tout pété",
    "photos": ["zekth-quefrency-1.jpg"]
  }
]
